question,answer
I'm looking for the Huntingdon Marriott Hotel.,The Huntingdon Marriott Hotel is on Kingfisher Way near the Hinchinbrook Business Park. Would you like me to make a reservation?
"Yes for one guest, for nights starting with Tuesday.","I'm sorry, but I'm not sure how many nights you want to stay. Did you mean to say four nights?"
No sorry I meant 2 nights.,Ok I've booked that for you with reference number SDMC5SZK . Is there anything else I can help with?
"Yes, I'm looking for a museum near the centre.","There are several, may I suggest Castle Galleries. And there is no entrance fee. Is there anything else I can assist you with today?"
I'm looking for something to do tonight. Maybe the theatre?,"There are 5 theatres, 4 in the centre and 1 in the south. There are no fees listed, would you like information on any of these?"
"Can you give me any one in the centre, and give me phone number and postcode?","you can try adc theatre, phone number is 01223300085 and postcode cb58as"
That is great can you also find me a hotel with a 0 star in the same area as the theatre,I have two choices for you. Do you need parking?
"No, I do not need parking but need wifi while in the hotel.",Let me look for a hotel with wifi.
"OK thank you, I would like the room for Thursday.",I have two options with internet do you have a price reference?
"Hello, I'm looking for a restaurant in Cambridge that serves high Chinese food and is more expensive than it's competitors.",I have some here can I get what area you would like to eat in?
I don't have a preference on the area. Can you make a suggestion?,How about the Ugly Duckling that is located in the city center?
"That sounds fine, can you book a table for 3 at 11:45 on Wednesday please?",You are booked for Weds at the ugly duckling refs number is U1BCCKQX
Can I get the phone also please?,"They is no phone information given, can I help with anything else?"
"Yes, i am looking for places to visit on the east side of town.",There are lots of attractions in the east! Do you have a preference for type?
I will like a place with no entrance fee and also a taxi that will take me from the restaurant to the place.,"Okay, I recommend cambridge artworks. For the taxi, I will need more information on either departure or arrival time"
"Hi, I'd like to find a cheap italian restaurant, please.",There are five cheap italian restaurants in town. Is there a particular area you prefer?
I prefer the north area of town.,"Great, there is a cheap Italian place in the north part of town called Da Vinci Pizzeria. Would you like a reservation?"
"Yes, please make one for 7 people at 17:45 on Thursday.",I have your table reserved at the requested day and time. It will be held 15 minutes for you. The reference number is: UB24W3TP .
Sounds good. Could you also help me find a cinema in the same area?,I'm sorry. There are no cinemas in that part of town. Would you like to try a different type of attraction?
Darn! I really wanted to go to the cinema. Is there a park located in that area?,"Yes, there is Milton Country Park in the north. It is free to enter."
I am looking a restaurant in the Centre Cambridge area that serve gastropub food.,"I have 3 in the centre of town,what price range please?"
Moderate price range.,The Nil moderately priced restaurant is in the centre and serves gastropub food. Would you like a reservation?
That would be great. Can you make if for a party of 6 on Tuesday at 15:30?,"Yes, I can make the reservation would you like their address?"
"I can find it, but please give me the reference number for the reservation. Nil is such a creative name for a restaurant!","Yes, it most certainly is. The booking was successful, and they will hold your table for 15 minutes. The booking number is CXFENRLZ . Anything else I can assist you with?"
"I also need a place to stay, moderately price, centre area, doesn't matter whether or not it has wifi.","I have one result for you. It is cityroomz, a 0 star hotel. Do you want to book this?"
"Oh yessiree, tuesday 6 people and 5 nights please",I am unable to make a booking for that right now. Is there anything else I can do for you?
"hi, i am looking for bar in town that serves food.",What area of town should it be in?
it should be in the east area and serve south indian food.,what about price specifications?
I would like something cheap please?,I don't actually have anything in town that serves Indian food in the east that's cheap. Can I try something else for you?
How about a restaurant that serves Chinese food?,I do not have any cheap Chinese food places in the east. Would you like me to search another area?
I really wanted South Indian food in the easy. Are there any choices regardless of price?,"Curry Prince is moderately priced, would you like me to book you?"
Yes please book a table for 3 people at 17:45 on sunday.,Done! The table will be reserved for 15 minutes. Your reference number is J7WQHV7J . Can I help you with anything else?
"Hello, I am planning my trip to Cambridge and need some help finding places to go in town when I get there.","Sure, we have much to offer. Did you have anything specific in town?"
I'm looking for a theatre.,There are 4 in the city centre and one in the south - do you prefer one area over the other?
Can you give me the address to the one in the south please?,It is called The Junction. It is located on Clifton Way. Their postcode is cb17gx. Their phone number is 01223511511. Anything else I can help you with today?
"Yes, do you have information on the cambridge belfry?",The Cambridge Belfry is a 4 star hotel in the cheap price range with internet and parking.
I need to book a taxi to come to Da Vinci Pizzeria by 01:45.,I can help you with that. where are you going?
I am going to Cambridge Road Church of Christ.,Your booking is complete. The taxi is a yellow Honda. Contact number 07024160438.
i am looking for a place to stay. The hotel doesn't need to include internet and should include free parking.,"Do you have any other constraints, such as location or price range?"
The location and price range don't matter to me. I want a guesthouse with 4 stars.,We still have a lot of great options to choose from. Can I recommend the Alexander Bed and Breakfast in the centre of town?
"Sure, that sounds fine, as long as you're sure it has free parking.",It does offer free parking. Would you like me to book it for you?
book for 1 people for 5 nights starting Thursday and get me the reference number please,Alexander bed and Breakfast - 56 saint barnabas road cb12de phone - 01223525725
And the reference number ?,I'm sorry about that. Your reference number is 4PSP6FIB .
Thank you. I'd also like to find a cinema in the west side of town. Do you know of any in that area?,I'm sorry but there aren't any cinemas in the west. Would you like to try another location.
"I need a taxi to take me to the hotel from the airport now, can you give me the number to call?",What specific time do you want to leave?
Never mind. I'm looking for a guesthouse to stay at. It must be in the north and 4 stars.,The Acorn Guest House is in the north and is rated 4 stars.
Okay great. Could I have their postcode and phone number?,The phone number for Acorn Guest House is 01223353888. The postal code is cb41da. Is there anything else I may help you with?
Yes I am looking for information on the Sesame Restaurant and Bar.,"The sesame restaurant and bar serves Chinese food, located in the centre area at Hills Road City Centre, postal code cb21nw17. You can contact them at this phone number, 01223358899."
i need a place to stay,"Okay, what area would you like to stay in and what is your price range?"
I am looking for a 4 star guesthouse with free parking in the expensive range.,I'm sorry I don't have anything that matches that criteria.
Okay. Do you have anything matching that description in the moderate price range instead?,"Yes, I have 9 options for you!"
Can you suggest one and make me a booking for 5 people for 5 nights starting from Sunday?,"Sure, your all set for the acorn house, your confirmation number is C9BFUP76 . Anything else today?"
I would like something fun to do in the middle of town.,Club Salsa is a fun nightclub in city centre. The address is 1 station road. Is this the type if attraction you were interested in?
I am looking for a good hotel in north Cambridge.,The acorn guest house is a nice guesthouse. Would that work?
Does it have a 4 star rating? I would like a place with four stars?,Yes it does. Would you like to book?
Yes please. I need it for 5 people for 4 nights staring from Thursday.,The booking was successful. Your reference number is : A9VM6FAU . Is there anything else I can do to assist you today?
I would also like more info about Pizza Hut in the city center.,There is a Pizza Hut on Regent Street City Centre. Would you like me to make a reservation for you?
"Hi, I'm looking for a place to stay in the centre.","There are 2 guesthouses and 3 hotels in the city centre, do you prefer one or the other, or are there any amenities that you'd like?"
"Yes, I would like it to have free wifi.",The Alexander Bed and Breakfast is a 4 star guesthouse that is cheap. Does that interest you?
Do they offer free wifi or free parking?,Yes to both.
Great. Please book it for 5 people for 5 nights starting from wednesday.,Unfortunately that didn't work. Do you want to shorten your trip?
"Sure, how about two nights?",I was able to book that hotel for you for 2 nights. The reference number is 8LCNFKVO .
Thanks. I'm also interested in going to the Chiquito restaurant bar. Can you make a reservation there?,Sure what time and how many people?
"Hi, I am looking for a restaurant. I would prefer an expensive restaurant in the west of the city.",We offer 9 such places.
Is there a British one available?,Great choice! I have two. Graffiti and travellers rest. Would you like me to book one of these?
I am looking for some rest as a traveler so I choose travellers rest. There will be four of us for Saturday at 11:00. Please book.,"I'm sorry, it seems they are unable to accommodate you at that day and time. Would you like me to try another?"
Can you try for 10:00 please?,A table is reserved for 10:00. Your reference number is TX8BTBJT . The table will be reserved for 15 minutes. May I help you with anything else?
I would also like to find a college to visit.,What area is this college in? Do you know the name of it?
I'm visiting the area and want to stay at rosa's bed and breakfast.,"Sure thing! If you can tell me the day you're arriving, the number of nights you're staying, and the number in your party, I'd be happy to book that!"
I'm still working out the details for all of that. Can you tell me the star rating of the hotel?,Rosa's bed and breakfast is a 4 star guesthouse located in the South. Can I help you further today?
Yes. I would like to visit a museum while I am there.,The Bryard Art Museum is also in the South and has no entrance fee. Will that do?
Does Cambridge have any expensive Austalasian restaurants?,Unfortunately there are no restaurants fitting your request. Do you want me to look for a different food type for you?
I like British also. Are there any British restaurants that are expensive?,There are 6 British restaurants that are expensive. What part of town would you prefer?
That doesn't matter. Which of the restaurants have an opening for a table for 1 person at 13:30 on wednesday?,I was able to book you for 1 at Fitzbillies restaurant. Your reference number is LLT7M4SU . Can I help you with anything else?
I also need an expensive place to stay.,There are 5 options. They are all hotels with parking and internet included. Do you have a preference for area or star rating?
I'm looking for a hotel with free wifi.,Which area of town will you be staying in?
I will be staying in the south can you book me a room and send me the reference number?,"Absolutely the only hotel in the south is expensive, is that okay?"
Could you look for something in the west?,In the wast I have huntingdon marriott hotel and the cambridge belfry.
"If it's in the west, I want it to be a 0 star hotel. Is it?","No, it isn't. There are no 0 star hotels in the west but there are plenty more hotels I can recommend"
Can you check for ones in the centre and have free parking?,The only place that I have in the centre that offers free parking and internet is a guesthouse called the El Shaddai. It is cheap and has 0 stars.
That should be fine. I also want some other places to go nearby.,There are many different types of attractions in that area. Do you have a type in mind?
I want to visit some colleges.,"Yes, there are 18 colleges. Do you have any particular area in mind?"
I would like it to be in the South.,I am sorry there are none in the south. Would you like to try another area instead?
How about just try looking for any cinemas in the south?,We have Cineworld Cinema in the South area.
"That sounds great! Can I have their address and phone number, please?","00872208000 is the phone number. The address is cambridge leisure park, clifton way."
"Hi, I'd like to book a taxi from London Liverpool Street to Club Salsa.",Before I can complete your request please let me know a departure and or arrival time. Thank you.
I can leave any time after 01:30. Can you send me the car type I can expect and the contact number?,You are all set. You will be picked up in a Blue Volvo at 1:45. The contact number is 07144891471. Do you need help with anything else?
"Hi, I am looking for information on place to go.",What area of town are you interested in going to?
I would like to go to the centre of town,I would recommend All Saints Church. They are located on Jesus Lane.
I would like to go to a college. Do you have any colleges in the centre?,There are 13 colleges in the area ranging from free to several pounds admission. I'd suggest christ's college and it's free!
"That sounds great, what's the postcode please?",The postal code is cb23bu.
I am also trying to find an expensive restaurant that serves indian food.,We have 14 restaurants matching your query. Do you have an area preference?
No can you just recommend your favorite to me please,I would suggest the curry garden.
I am looking for a multiple sports location in the centre of town,Unfortunately there are no multiple sports locations in the centre of town.
"Hmm, okay. Well, maybe we should take a look at a local college in town centre. Could you recommend one?",I can recommend Christ's College. Admission is free.
Sounds good. Could I get the phone number?,Absolutely. The phone number is 01223334900. Is there anything else I can help you with today?
"Yes, I would like to book a hotel that has free wifi. Parking doesn't matter.",I have found 9 hotels with free internet. Do you have a price range you are look for?
I would like it to be not be more that $120 a night.,Does the Gonville hotel work?
Is Gonville hotel in the town centre?,"Gonville Hotel is in the ""centre"" area."
Does the hotel have a star rating of 0?,It has a rating of 3 stars.
"Hello, can you recommend a moderately-priced hotel in the Centre of town, please?",Yes the name of the hotel is cityroomz would you like me to book it for you?
Does it include free wifi,Yes. There is free wifi.
I want to book it for 8 people for 4 nights please!,"Certainly, when would you like to arrive?"
Arriving on tuesday,"I was able to book it, the reference number is JC2OYOAS"
"Alright, are there any moderately priced indonesian places nearby?","I'm sorry, but there are no Indonesian restaurants in Cambridge at any price point."
"Okay, let's try Chinese. Are there any Chinese restaurants in the area that are also moderately priced?","Yes, I would suggest this one jinling noodle bar."
I am looking for a attraction called whipple museum of the history of science.,That museum is in the centre of town on free school lane. Is there other information you are looking for?
How much is admission?,They offer free admission. Is there any other information I can provide for you?
"Yes, find me a cheap place to eat in the center",What type of food are you interested in eating?
"I am interested in Italian food. However I just remembered, I need the phone number for Whipple Museum of History and Science please.",Their phone number is 01223330906.
There are a couple Italian restaurants in the area ranging from moderate to expensive. Would you like me to look them up for you and make a reservation?,"Not at this time, could I just have the phone number of an expensive Italian restaurant?"
You can help by getting me a taxi to curry king,"Sure thing, when you like to leave by?"
I'd prefer to leave after 02:30,I can definitely help! Where are you departing from?
Are there any museums in Cambridge?,"There are about 23 different museums to choose from. To help narrow it down, do you have a part of town you prefer to visit?"
I'd like information of cambridge museum of technology. What is their phone number please?,The phone number is 01223368650. Anything else I can help you with?
Can I have their address?,"The address is The Old Pumping Station, Cheddars Lane. Is there anything else I can help you with?"
I am also looking for a place to dine in the moderate price range.,I found 110 restaurants. Please tell me what type of food you like to help narrow the search so i can best serve you.
"I'm thinking british food. oh, and if it's in the west that'd be even better.","There is Saint Johns Chop House that meets your criteria, would you like me to book it?"
Please find me a taxi? I'm at the el shaddai and I need to arrive by 21:15.,Okay. I will need your destination first.
I'm going to cocum.,I have a white bmv with a contact number of 07785490051.
i need places to go in town,What did you have in mind?
Do you happen to have any entertainment places in the centre of town to visit?,"We have museums, colleges, and interesting architecture, as well as many other choices in the center of town."
"Any type will do, as long as its in the centre. Can you recommend something?","Ballare, a beautiful new nightclub just opened up in the center. Entrance is just 5 pounds, would you like more information on Ballare?"
"Yes, can I have their address with postcode?","The postal code is cb23na and the address is heidelberg gardens, lion yard. Can I assist you further?"
"Yes, can I please have car type and contact number?","It seems like you are asking for a taxi. Where are you departing from and where is your destination, please?"
"Yes, sorry for the confusion. I want a taxi to pick me up at the hotel at 05:00 and my destination is Ballare. Please give me car type and contact number","Sorry, you'll need to be more clear on your departure site please. Is there a specific hotel you're looking for?"
I would like to find a cheap indian restaurant to dine at.,There are 4 cheap Indian restaurants in town. Do you prefer to go to a specific area of town?
"Yes, I want to go in Cambridge and I will need the address, postcode, and area to find it.",There are 4 restaurants that meet your request. Can you tell me what area of town you'd prefer?
I have no preference but I would like an attraction to visit in the city center.,"I would recommend the Royal Spice restaurant in the north, on Victoria Ave in Chesterton, postcode cb41eh. What area would you like your attraction to be located in?"
I would prefer it to be in the centre. Could you give me the address and postcode?,"Can I recommend kohinoor, it's address is 74 Mill Road City Centre,and the postcode is cb12as."
What sort of attraction is Kohinoor?,"I'm not sure, Kohinoor is not listed in my database. Are you sure you spelled that correctly?"
I need a taxi between the restaurant and the hotel .,what time would you want to leave?
I want a place to eat that serves swiss food.,"there are no restaurants with swiss food kindly suggest another,"
How about does anyone serve European food?,I have many places serving European food. Do you have a price range preference?
It doesn't matter. Please make a recommendation and book a table for 8 people at 11:30 on saturday.,"Michaelhouse Cafe, 15-19 Trumpington Street, reservation for Saturday for 8 people. The table will be reserved for 15 minutes. Reference number VRZWVKT7 . Will there be anything else today?"
I am also needing help finding a room. I don't care if they offer free parking or internet.,I have so many choices for you. It would be better to narrow the down by area.
"I'd like a hotel in the south to stay at. It doesn't need to include internet, nor no need to have free parking. Closer to the restaurant would be preferred.",I would recommend Rosa's Bed and Breakfast. Would you like to make a booking?
I don't need a reservation right now but can I get more information?,Rosa's is a guesthouse in the cheap price range. It has 4 stars. The address is 01223512596 and the postcode is cb22ha. Do you need more information?
I need a taxi today arriving at 21:00.,I need a little more information. Where are you leaving from?
Oh I'm sorry - I need to be picked up at the whipple museum of the history of science.,What is your destination?
I want to go to restaurant two two.,And do you want to be picked up from whipple museum at 2100 or get to restaurant two two at 2100?
"Yes, I am planning my trip to Cambridge. There are so many things to do it seems. Exciting. Can you help me with some information?","I certainly can. We have nearly 80 different attractions around town. First of all, do you have any preference as to the area of town you want to visit?"
I would like the centre area please.,"What types of attractions are you interested in, buildings, museums, nightclubs?"
I am most interested in museums.,"There are several museums, do you prefer an art or history themed museum?"
Just any type of museum will do.,"Cambridge contemporary art is available, are you interested in that?"
"Yes, that sounds good. Can I get their phone number and postcode please?",Sure! Their phone number is 01223324222 and postcode is cb21su.
"Thank you, can you also help me with finding a hotel in the est?",Would the Express by Holiday Inn Cambridge be good?
Hello! I'm traveling to Cambridge soon and would love to visit a concerthall in the centre of town. Can you help?,The man on the moon is a concerthall in the centre of town. Would you like the address?
"Yes, and could you give me the phone number too?",Oh of course! Their number is 01223474144.
"And the address is? And while we're talking about location, are there any 3-star hotels close to it?","The man on the moon's address is 2 norfolk street, postcode cb12lf. There is one hotel in that area with 3 stars, the Gonville Hotel. Would you like a reservation?"
"Do they have free wifi? If yes, please book for 2 people for 1 night. Thank you for your help.",They do have free wifi! For which day would you like the reservation?
I'm craving some spicy food so find me an Indian restaurant on the East end please,The Curry Prince might fit the bill. Would you like reservations?
no not right now thanks,Okay. Would you like help with anything else?
"Yes, is the Curry Prince in the moderate price range? If so, I'll need to make a reservation.","For how many, and day and time?"
"8 people at 12:15 on Friday, please.",Done! Your table will be reserved for 15 minutes. Your reference number is 4YZLGJJL . Is there anything else that I can help you with?
I need to book a room too a guesthouse that doesn't have internet but free parking,Would you like the guesthouse on the east side of town as well?
That would be fine.,There are 4 different options. 3 of the guesthouse are cheap and the oter 2 are moderate priced. Is there one you'd prefer?
"I need a place to stay, can you help?",What price range and in what area?
"I don't care about price, but I'd like to stay in the south. I do like guesthouses better than hotels.",Do you have a preference of number of stars?
I do not have a star preference.,How about Aylesbray Lodge Guesthouse on Mowbray Road? It has 4 stars and is in the moderate price range.
"Great. Can you tell me their post code, and if they have internet?",The postcode is cb17sr and they have internet. Would you like me to book it?
I'm not ready to book yet. Would you also look up places I can visit while I am in town?,"of course, any museums you're interested in?"
i am looking for a place to stay. The hotel should be in the type of guesthouse and should be in the east.,There are several to choose from. Is there a price range you are looking for?
"Yes, I'm on food stamps and I can only afford the cheapest place.","There are 3 guesthouses available. All are 4 star rated and offer free parking and wifi. They are the Allenbell, the Autumn House, and the Leverton House."
"Do they have free wifi, and parking? Free is my ideal price.","Yes, the guesthouses all provide free wifi and free parking. Would you like to a book a room at one?"
"No, but could you give me the postcode?","There are three guesthouses that meet that criteria, Allenbell, Autumn House, and Leverton House. For which would you like the postcode?"
"May I have the postcode for the Allenbell, please?",sure thing it is cb13js
I also wanted to find a nightclub to visit while I'm there.,there are quite a few in the towns centre. the kambar is quite nice at 1 wheeler st
I would like to book a taxi to the gandhi.,"I can help you book that, first I'll need to know where you'd like picked up at."
I want to be picked up at prezzo please,I'll need a little more information to find you a taxi. What time would you like to arrive at the ghandi?
I would like to get some information about a local restaurant and a hotel please. Include the best options for me.,"Ok, lets start with a hotel, any preference of type, area or price range?"
