question,answer
I am looking for a hotel named alyesbray lodge guest house.,"i have their info, what would you like to know?"
I would like to book a reservation for it. Can you help me with that?,"I sure can. First, I will need to know when you want your stay to begin and how many days you'll be staying. Also, how many people will be staying?"
We will be arriving on Sunday and will stay for 5 nights.,Can you tell me how many guests will be staying in the room?
There will be 8 guests.,Booking was successful. Your reference number is 4UFN3SWC . Will that be all for today?
that is it thank you.,You have a nice day then!
I'm looking for a places to go and see during my upcoming trip to Cambridge.,What area of town would you like?
I would like to go to the south area please.,"On the south side, your options are the cinema, entertainment venues, museums, nightclubs, parks, and a theatre."
"That's a lot of choices, how about nightclubs? Can you get me a couple of phone numbers for good ones? I'm hoping to catch DJ Squalour from Ibiza!",The only nightclub in the south is called the place on 22 sidney street. Phone number is 01223324600. Can I help you with anything else?
"Yes, I would like an expensive hotel with free parking.","I have places that fit that description all over town, except in the north. If area is no concern, I recommend the Gonville in the center of town."
I need a 19:15 taxi to take me to Avalon.,I can definitely help! Where are you departing from?
I will be departing from Primavera.,You car has been booked. It is a black volvo. Can I assist you any further?
Good day. Might you be able to assist me with a taxi going to Corpus Christi leaving sometime after 08:45?,Sure I can do that! Where is the departure site?
I need it to pick me up from gourmet burger kitchen.,The car coming is a White Tesla with contact number is: 07441094025
"I'm looking for a hotel, can you help?","I can, we have 9 hotels, do you have anything else to narrow it down?"
It should be in the centre and be on the expensive side.,I have 2 available hotels. One is the Gonville Hotel located on Gonville Place. The other is University Arms Hotel on Regent Street. Which one would you like to book?
Can you book the one without wifi?,"they both have internet, for what days and how many people should I book?"
Do either of them offer free wifi?,"As previously mentioned, they both have internet available. I don't have specifications about the internet service however. Would you like to book one of these?"
"Yes, please book for two nights beginning on Sunday for one person.",Your booking was successful and the reference number is ELYPAXQZ .
Thank you. I'm also looking for a museum to go to in the same area.,there are 11 all with free entrance. Would you like me to recommend one?
Can you assist me in finding me an Expensive Restaurant in Cambridge where I can dine? The restaurant should be serving British foods.,"sure, i have 6 options for you"
I'd like it to be in Centre.,I would suggest midsummer house restaurant it has great food.
Can you make me a reservation for Saturday please for 3 people?,What time would you like to dine on Saturday?
We will be dining at 16:30. Please book a table for 3 on Saturday and provide the reference number. I also need a hotel in the same area.,"Alright, I have your restaurant booking. Your reference number is: DHDB0H4V . What are you looking for in a hotel, so I can narrow down the choices?"
Something in the same area as the restaurant. It should also be in that same price range.,I've got two expensive hotels in the area. Both have internet and parking. university arms hotel has 4 stars. Does that meet your needs?
"Yes, that should be perfect thank you.","Would you like me to book you a room? If so, i will need how many people and nights you will be staying and on what day."
"I would like a room for three people, just for Saturday night.",The booking was successful I have a reference number and the hotel number for you.
I need a taxi to don pasquale pizzeria.,When would you like to arrive?
I would like to arrive at one o'clock p.m. because I am meeting my husband there when he goes on his lunch break.,"Ok, where are you departing from?"
I will be departing from finches bed and breakfast.,Alright. I have a white honda for you.
I am looking for information in Cambridge. I need a place to dine.,"Sure, do you have a type of food you are wanting?"
Crossover food would be perfect.,"Unfortunately, there aren't any crossover restaurants in Cambridge. Is there something else you'd like to try?"
Is there a gastropub in Centre?,"Yes, I have two that are expensive and one that is moderately priced. Do you have a preference?"
Let's go with the moderately priced option. Can I please have the phone number?,"In the moderate price range, I have one place. It's called the Cow Pizza Kitchen and Bar. It's located on Corn Exchange Street. Do you need a reservation?"
"Not right now, but I am looking for a place to stay. Are there any 5-star accommodations in Cambridge?","I'm sorry, there are no 5-star accommodations anywhere in Cambridge. There are many 4-star options. Would you like to try one of those?"
Do you have one with free parking,Yes the allenbell does.
"I need a hotel with free wifi and free parking, thank you",Allenbell is cheap and has free internet.
I'm looking for something in the moderate price range actually.,Archway House is a moderately priced 4 star hotel in the North. Would you like to make a reservation?
Yes please book the Archway House.,"I'd be happy to book for you. How many people will be staying, what is your arrival day, and how many nights are you staying?"
I will be arriving on tuesday and I need to book the room for four nights for three people.,Ok. I've booked that guesthouse for you. Your reference number is YBT4JRTR . Can I help with anything else?
"Yes, I would also l like to find a splendid, moderately-priced place to dine in the centre. That would be just wonderful if you could help me out with that!",There are several moderately priced restaurant in the centre area. Would you like a certain type of food?
"Hi, I need a moderate price range restaurant in the centre of town.",There are 21 restaurants that are moderately priced in the centre of town. Do you have a food preference?
British or European would be fine. May I book a table for 2 at 16:00 on a Wednesday and get a reference number please?,"The oak bistro is a British restaurant in the centre area, in the moderate price range. Would you like to book this restaurant?"
Yes. The booking should be for 2 on wednesday at 16:00. Could I also get a reference number?,"Alright, you're all booked! Your reference number is YWEKSO7H . Is there anything else I can help you with?"
I'm also looking for a place to visit within the same area as the restaurant. Do you have any recommendations?,"We have parks, boats, museums, and many other interesting things to do. What strikes your fancy?"
"I am traveling to Cambridge and excited about seeing location attractions. Could you help me find a place to go, like a college?",Certainly. I have many available. Is there a particular area you are looking in? I have several in the west and centre.
Can you give me the entrance fee for one of the colleges in the centre?,"Corpus christi is 2 pounds, which is in centre."
I'm also looking for a hotel in the centre. I don't want to stay in a guesthouse. It needs to be a hotel.,"I can book you at the university arms hotel. It has a 4 star rating, free parking and wifi. Does this interest you?"
Yes. That would be great.,What will be the first day you will stay and how long will you be staying?
I don't know if this is possible but can you please get me some information on the alexander bed and breakfast?,"sure, i have their information. what would you like to know?"
"Ah, I just wanted to know it was still open. Could you book me a room?","Sure, what day would you like it for?"
3 nights starting from friday.,A reservation for 1 person?
"No, I would like it for 4 people.",Booking was successful. Reference number is : CRLJAWX3 .
I also need to find an Indian restaurant in the east please.,"There are a few Indian restaurants in the east, do you have a price range you are trying to stick to?"
In the mid-range would be fine.,Rajmahal is a moderately priced Indian restaurant. How many people will be dining?
I need a place to eat that is expensive.,I've found 57 restaurants that match your request. Is there a particular area you'd like to dine in?
"In the centre, please.","There are 33 restaurants in that area, do you have a preference of the type of restaurant?"
i want something with malaysian food.,"I am sorry I have no listings for malaysian food,another type?"
I actually just need an expensive place to dine in the Centre of town.,Kymmoy offers Asian Oriental food. Would you like to book a table there?
Yes please. Can you book that for 8 people on Saturday at 15:30?,Sure thing. I will work on getting this booked and be right back with you.
"Okay, thank you.",you are welcome
"If Saturday fails, try Monday and provide the reference number. Also looking for a guesthouse in the same area with internet. Provide starts and address please.",Your restaurant booking was successful. This is the reference number PQA4WKNF . It is for Saturday at 15:30 for 8 people.
I want to know where I can go in the town centre of Cambridge.,There are many places to go in the centre. Are you looking for an attraction or restaurant?
"An attraction of any type would be fine as long as it's in the centre, please.",I could recommend old schools. It is architecture and free to see. Would you like more information?
Yes tell me one of those recommendations.,Old Schools is an architectural attraction on Trinity Lane that has no entrance fee. Their phone number is 01223332320. Can I help you with anything else?
Can you provide me the full address including postal code? Thanks.,The address listed for Old Schools is simply Trinity Lane. And their postcode is cb21tt. Is there anything more I can do for you today?
"Yes, I would also like to find an expensive restaurant in the same area.",What kind of food would you like and what price range
Can you help me book a taxi please?,Yes what is your departure site?
I would like a guesthouse in the moderate price range. Do you think you could find one for me?,What part of town would you like to stay in?
"I have no preference, but the guesthouse should include free parking.","Acorn guest house meets all your needs, would you like to book that?"
That's perfect. I would like to book it for 1 person. It needs to be for 4 nights beginning Saturday.,"I'm sorry, but the Acorn Guest House doesn't have those dates available. Would you like to try for a different day or shorter stay?"
"Yes, please try booking for 2 nights.",Your booking for 2 nights at the Acorn Guesthouse was a success! Your reference number is R4ES2ZFT . What else can I do for you today?
Are there any attractions to see in town? I'm interested in going to a museum if any exist.,We have 79 museums listed. Would you like a certain area of town?
I'm looking for a restaurant that serves international food.,There are three international restaurants in Cambridge. Do you have a price preference?
I would like to find a moderately priced place and I need a reservation for 4 people at 12:15 on a Thursday.,Okay I have the Bloomsbury and the Varsity restaurants. But I was unable to reserve either. Is there another time that would suit you?
"Yes, could you make it for 11:15, and can you give me the reference number?","Alright, I have booked you a table for 11:15 at the varsity restaurant. Your reference number is HM90EAET . Is there anything else I can help you with?"
"I am looking for some entertainment, do you know anywhere I could go in the centre of town?",Unfortunately I don't see anything entertainment related in the centre of town. How about another area of the city?
That's fine. I'd like to know about museums in the area instead.,"Fantastic, there are 11 museums in the centre. Can I recommend the Fitzwilliam Museum, if you don't have a preference?"
Fitzwilliam Museum sounds great. What is the postcode?,The postcode is cb21rb.
Is there anything interesting to see in the centre of town?,"In addition to architecture, colleges, and museums, we also have boat attractions, nightclubs, and theatres in the centre."
I would be interested in seeing some interesting architecture.,"There are a few places, mainly churches, that have great architecture. Do you want information on any of those?"
"No thank you though. I would like information on greek restaurants that would be in the same area as the churches you suggested, please?",there is no greek restaurant in the centre. can we change the location?
"Well, how about African food?",Bedouin is an expensive serving african food in the centre of town.
"That sounds good, can you book 2 people at 13:30 on Tuesday.",Booking was successful. Reference number is : IA596HSH . Is there anything else I can do for you?
"Yes, I'll also need a taxi to commute between the two places. I'll need to be at the restaurant by 13:30, of course.",Okay and where do you need the taxi to pick you up?
I'd like to find out more about expensive restaurants in the city centre.,they are many. what is your prefered food type?
"Are there any restaurants that serve French food? If so, I will need the phone number to the restaurant.",yes cote does. can i give you their contact?
Yes please. I did state that I wanted the phone number.,The number for Cote is 01223311053. Is there anything else I can do for you?
"Can you give me some information on a hotel called holiday inn Cambridge, please?","The Express by Holiday Inn Cambridge is an expensive, 2-star hotel in the east. They're located at 15-17 norman way, coldhams business park. Can I book a room for you?"
"Hi, I am planning a trip and need some suggestions. I am looking for places to go in town.",Can I ask you some questions about the types of places you want to go while you're in Cambridge?
The attraction should be in the centre and should be in the type of cinema.,"The Vue Cineme is in the Grafton Centre, on East Road. Do you need any more information?"
What is the postcode for The Vue Cineme?,The postcode is cb11ps. Is there anything else I can help you with?
"Yes, I'd also like to find a moderately-priced guesthouse on the west side, if possible. I do need free wifi.",I have one place.Shall I book it?
"Sure, I'll be coming in on Sunday with one other person. We'll be staying for 3 nights.",Okay. Your booking was successful. The reference number is UOE033DZ . Can I help with anything else today?
Can you book me a taxi to get me from the cinema to the hotel?,"Absolutely, when did you want to leave?"
"Hi, I am planning a trip to your beautiful town and am looking for places to go when I get there. Can you help me?",Certainly. Do you have any particular types of things you'd like to see?
I'm interested in exploring the local architecture.,There are many colleges and churches to see.
Do you have a favorite?,My favorite is clare hall.
I need a place that is architecture.,How about old schools? It is architecture and a school!
"Could I have the postcode, area and entrance fee of what you recommend?","Okay, Old Schools is on Trinity Lane and is in the centre. Post code is cb21tt and it is free admission."
"Thanks! I'm also looking for an expensive, 2-star place to stay in the north. Do you have anything like that?",there are no expensive hotel in the north. can you change the location?
I am looking for a restaurant in the centre of town.,There are 69 restaurants in the centre. Is there a specific type of cuisine or price range you are looking for?
"I am looking for an expensive restaurant in the centre, type of food does not matter but I need a table for 7 people for Tuesday at 13:15.",Unfortunately there is no vacancy on that day at that time. Can we try another day or time?
Could we try for Tuesday at 12:15 please.,"I made a reservation at Bedouin, an African restaurant, for 7 people on Tuesday at 12:15. Your reservation number is PN95JSUF . Is there anything else?"
"Yes, I'm looking for a particular attraction called Whale of a Time. Do you have any information on it?","Yes, Whale of a Time is located in the west part of town, phone number is 01954781018. Any other questions?"
I'd like to find out more about taking a tour of Trinity College.,"I do not have information about tours, would you like the phone number for Trinity College?"
"Actually, can you tell me what type of attraction it is? My friend suggested it and mentioned the name, but not much else.",It is a college located on trinity street. The entrance fee is 1 pound. May I help you with anything else today?
"Yes, I'd like to find a restaurant in the centre of town.",Of course. There are many restaurants in the area. Is there a food type you're interested in?
I would chinese please.,Is there a price range you'd like to stay in?
"Yeah, I'd like a moderately priced restaurant. And type of food doesn't actually matter. Just somewhere moderately priced in the centre of town.","May I suggest Jinling Noodle Bar, they have excellent food moderately priced. Would you like a reservation?"
"Hi, I need a hotel on the west side, please.","We have a couple options available to you, is there a particular price range you are looking for?"
"I don't care about price range, but I do want the hotel to have a 4 star rating and have free wifi.","I have the Huntingdon Marriott that is more expensive. Also, the Cambridge Belfry that is cheap. Do you have a preference?"
Can you tell me their post codes?,Huntingdon marriott post code is pe296fl and the cambridge belfry postcode is cb236bw. Anything else I can assist you with today?
No. Thank you. Goodbye.,You're welcome. Have a wonderful day!
I also need information on the maharajah tandoor restaurant please.,It is an expensive restaurant in the west area serving indian food. Would you like me to book it for you?
I'm looking for an expensive restaurant in the center of town.,"There are many expensive restaurants in the centre of town, is there a specific type of food you would like?"
Is there any Turkish cuisine? If so I need the postcode and the address.,The Meze Bar restaurant matches your tastes. It is located at 196 Mill Road City Centre. The postcode is cb13nf.
I am also looking for museums in the area.,"There are many museums listed in the centre area, what kind of museum are you interested in?"
"I don't really care, what do you recommend? I will need the postcode and entrance fee please.",How about Cambridge Contemporary Art? The entrance is free and the postcode is cb21su. Enjoy!
I need to get a taxi out of holy trinity church.,What is your destination?
I'm going to saint johns chop house.,I can help you with that. When do you need to leave?
I need to arrive at the chop house by 22:30.,Your taxi is booked. Look for a yellow Volkswagen.
I'd like for a taxi to take me to gonville hotel today,And where will you be leaving from?
I'll be departing from j restaurant.,What time would you like to depart at?
I'm looking for a place to dine in the centre in the moderate price range.,Would you like a table at Cotto?
"Yes, that would be fine. I don't need a book but can you give me the phone number and address for Cotto? Thanks","Sure! The phone number for Cotto is 01223302010 and the address is 183 East Road, City Centre. Is there anything else I can help you with?"
Can you tell what attractions are near the restaurant?,There are 44 attractions in the centre of town. Do you have particular type of attraction in mind?
"No, what do you recommend?",The old schools is wonderful located at trinity lane.
I am looking for some places to go in town. I'm so excited about seeing some of the local attractions.,There are many to choose from! Almost 80. Can you tell me if you have a certain type of place you want to visit?
"What do you recommend? I will be need the address, entrance fee, and postcode for what you recommend please.",I honestly recommend visiting a famous college such as Christs or Magdalene.
"Could I have the address, entrance fee, and postcode.",Christ's College is on Saint Andrew's Street and postcode CB23BU. There is no entrance fee. Can I help you with anything else?
"Yes, I'm also looking for a place to stay. The hotel doesn't need to include internet.",There are about 33 hotels that meet your needs. Can you narrow it down to a certain area of town and price range?
"I'm sorry,was Christ's College in the centre? I did need something in that area.",Yes it is in the centre.
Is there one in the centre with free parking,"Sorry, parking isn't something that is mentioned for attractions."
I am looking for an expensive gastropub restaurant in Cambridge,I see there are two in centre and one in East area. Do you have a preference?
Yes I need the one in the east.,Great! That's the Royal Standard at 290 Mill Road City Centre cb13nl. Would you like to book a table?
Yes. We need a table for 2 at 14:45 on Saturday.,Sorry booking was unsuccessful. Would you like to try a different time?
How about at 13:45?,Your table is booked! It will be reserved for 15 minutes and your reference number is 9M44WAHK .
Thank you so much. Can you help me find a place to stay? I would like a 3 star place that's in the expensive price range.,I recommend the Lensfield hotel on the south side. Shall I book a room?
"I would like it to have free parking, please.","The Lensfield has free parking and free internet. Did you need a room there, or perhaps their address?"
"I would like to book a room, please.","Ok, I can book a room for you at the Lensfield Hotel, I just need some information. For starters, what day would you like to check in?"
I'm looking for a cheap portuguese restaurant,Nandos in the South and Nandos City Centre in Centre meet that criteria. Would you like more information on either of these?
"Yes, could I get the location and the phone number please.",Do you want the information on Nandos in the south or the Nandos City Centre?
"I prefer the Nandos in the City Center. Also, I need information about museums or art galleries in the west.",Nandos' number is 01223327908. There are several museums in the west. I've heard that Cafe Jello Gallery has some lovely pieces. Or would you like to hear about the others?
"Yes, I am looking to kill some time in town. Are there any museums on the west side?","Yes, Cafe Jello Gallery fits that bill. Admission is free and it is located at Cafe Jello Gallery, 13 Magdalene Street. There are others in the area as well."
Thank you. What is the post code for Cafe Jello Gallery?,Their postcode is cb30af.
"Howdy, it would help me a great deal if you could please get me some information about the alexander bed and breakfast",it is a cheap guest house located in the centre. you want their phone number?
I would like the address please.,They are located at 56 Saint Barnabas Road. Do you need help with anything else today?
Could you provide me with the star rating of the Alexander bed and breakfast?,They are 4 stars. Does that work for you?
"Yes, that is perfect! Can you also find a restaurant in the centre? I'm looking for Mediterranean, but not too expensive.","The Gardenia is your best bet. It's cheap, but fantastic. Would you like to book a table?"
"I need the phone number, address, and postcode",The phone number is 01223356354.
I would like to eat at cheap restaurant in the centre while I am here in Cambridge.,"Is there a food type you have a preference for? Spanish, Italian, Chinese, Indian are just some of the choices."
"No, I don't really care what kind of food it is as long as it's cheap. I will need a reservation for 1 person at 14:45 on Monday.","Okay, I've got the dojo noddle bar in the centre of town that serves cheap food. How will that be?"
"I'd like to book a table for 1 at 14:45 on monday, please. I also need the reference number.",I have booked the restaurant for you. The table will be reserved for 15 minutes. The reference number is Y3MGYYH6 .
I also need a hotel that is near the restaurant.,There a 5 places in the centre. Do you have a preferred price range?
No price range. I do need it to have free wifi and parking though. Can you tell me what star that hotel would be?,How about el shaddai? It has free parking and wifi and is in the centre of town.
"That sounds good. What is it's star rating, please?",The star rating is 0. Would you still like me to book this hotel for you?
I need to find a place to eat in Centre please.,The Golden House is located at 12 Lensfield Road in the City Centre. The phone number is 01842753771.
Thank you. Can you let me know what the price range for the restraunt is? I'm looking for somewhere cheap.,The Golden House is in the cheap price range. Would you like to book a table?
What is the food type?,They serve chinese food there.
"No. I need a guest house, same price as the dining place.",What area would you like to stay in?
I need a hotel in the east which includes free wifi.,"Yes I have a few in the east that have internet,would you like me to get the information on a few for you?"
"yes, I would also like for it to be a guesthouse style and in the area of east, thank you","I have a few different options available, did you preference a moderate or cheap priced hotel?"
I don't have a preference on price. It also doesn't need to have free parking.,"I found one option with your preferences, the A and B Guest House. It has a moderate price range and 4 stars."
"That sounds lovely. I also am looking for an Italian restaurant in the moderate price range, can you help me?","Absolutely, you have five choices. Would you prefer a place in the south, centre, west, or east side of Cambridge?"
"I'd like a place in the east, please.","That would be pizza Hut Fen Ditton, what time would you like to go?"
