question,answer
I am looking for a park to go visit.,"There are 5 parks here in Cambridge, did you have a particular area of town you'd like?"
"No, not really, do you think you could recommend one?",Yes. Cherry hinton water play is located in the east. Would you like anymore information?
Yes. Can I please have the phone number and address?,"Certainly. The park is located at Cherry Hinton Hall, Cherry Hinton Road. The phone number is 01223446100. What else can I do for you?"
I am also looking for a four star hotel in the south.,"There are no four star hotels in the area, could I look somewhere else or another star rating?"
Are there any four star guesthouses in the South?,There are no four star guesthouses in the South. Is there a different type of four star guesthouses that you are looking for?
"How about just any guesthouse in the south, then?",There are two guesthouses that meet your criteria. Would you rather have something in the price range of moderate or cheap?
I guess moderate would be better.,I would recommend the Aylesbray Lodge guest house. It's moderately priced and located in the south with free wifi and parking. Would you like assistance booking there?
I'm looking for museums to visit in town.,"the broughton house gallery is a fantastic museum in the centre. Bonus, it's free!"
Where exactly is that located? And is there a fee to enter the gallery? How is the area? Is there a lot located around it to do? Thank you!,It is in the Centre and it is free to enter. Would you like to know anything else?
I also need a place to stay. I would like a hotel with 4 stars and free parking.,"There are several 4 star hotels with free parking, are you looking for one in the north as well?"
"No, I am not.",I think the acorn house will suit you well. Would you like me to book that?
"Can you book that for 1 person, 3 nights, starting Thursday?",Booking was unsuccessful. Would you like to try booking on a different day or for a shorter duration?
Actually yes you can help me find a hotel on the North end that offers free parking,There are 11 to chose from do you have a price range you prefer?
"Oh, wait. I think maybe a guesthouse would better suit our needs.",How about the arbury lodge guesthouse?
That sounds to be a good one. May i please have their address and description of the location?,"The Arbury Lodge is located in the north part of town, at 82 Arbury Road. Do you want to make a reservation?"
"Actually, right now, I just need to have the address. Also, I need to find a restaurant. Expensive with northern European food.",The address for Arbury Lodge Guesthouse is 82 Arbury Road. There are no expensive North European restaurants in Cambridge. Do you want to change the food type?
How about an expensive Korean restaurant?,"little seoul has great food, when would you like the reservation for and for how many?"
Six people at 17:45 on Wednesday would work great. Can I get a reference number please?,The reference number is R20I7FP5 do you need help with anything else?
Can you find me a guesthouse with a 4 star rating?,"I have a number of guesthouses available, do you have a location preference?"
"Not really, but I do need free parking in expensive range","I'm sorry, but we don't have anything that meets your requests. Would you like to change what you're looking for? Maybe I could help you with something else?"
what about the one with a cheap range?,"I have seven cheap 4 star guesthouses with free parking in the cheap range. One in the center, three in the east and one each in the north, south and west."
Can you recommend one? I need a reservation for tuesday,alexander bed and breakfast would suit your needs. How many people will be staying and for how many days?
i want to book it for 1 people and 3 nights starting from tuesday.,Reference number is : BL0Z1OXC . Anything else I can help with?
Im looking for a guesthouse with free wifi,I have found several possibilities for you. Do you have any particular area you would like to stay in?
In the south would be better.,I have two in the moderate price range and one that is in a lower price range. Do you have a preference as far as that goes?
"I don't care about the price range, I just want to make sure it has free wifi and is a guesthouse in the south.",I would recommend Rosa's Bed and Breakfast located at 53 Roseford Road. Can I reserve a room for you?
Does it have free parking?,Yes this guesthouse has free parking. Would you like to reserve a room?
"No, but I would like the address, postcode and phone number please","Rosa's Bed and Breakfast address is 53 roseford road , postcode cb22ha, and phone 01223512596. Can I look anything else up for you?"
I'm looking for a 4 star hotel to stay in.,What day would you like me to book a hotel?
"Before I book, I'd like to make sure that it is a guesthouse with free parking. Do you have anything with those amenities?",yes. there are 16 options. Do you have a price point?
Anything works. Is there a 4 star guesthouse with both free parking and free wifi?,Acorn guest house is a 4-star guest house with free parking and free wifi. Would like me to book it for you?
"Yes. I need 6 rooms for 3 nights, starting saturday.",I was able to get you those 6 rooms. Your reservation number is HAG2VEZK . Is there anything else?
"Yes, I'm also looking for a cheap place to eat that serves modern european food.",The river bar steakhouse and grill is available if that works for you?
I'm looking for a train that leaves on Thursday after 21:30.,Where will you be traveling to?
I will be going to Broxbourne.,"I have 2 trains going to broxbourne, do you have an arrival time preference?"
i just want to leave after 21:30,Will an arrival time of 22:01 work for you?
"Yes, that would be fine. I'll need the price and travel time for that, please.",will you be leaving cambridge?
How are you doing today? I need to find a hotel on the North side of town that offers internet at no extra charge,do you have a price range in mind?
"no, but it should be a guesthouse",Arbury lodge guesthouse is in the moderate price range in the north part of town.
Is that my only option? I need a guesthouse in the north and internet is not important.,"No, there are 10 guesthouses in the north. Do you need something specific?"
"No, please recommend one for me and give me the address.",I still recommend arbury lodge guest house. Its a four star hotel and have very good reviews and it has both free wifi and parking.
That sounds great. Can I get the address please?,"Yes, it is located at 82 Arbury Road, postcode cb42je."
Thanks. Are there any restaurants in that area that serve Corsica cuisine?,There are not any Corsica restaurants in that area. Is there a different type of cuisine you would like for me to check?
i am looking for a hotel in the south.,"We have one place the lensfield hotel, would you like more information?"
it should have a 4 stars rating,"According to my records, there aren't any hotels that meet your requirements. Sorry! Would you like to try something else?"
How about a guesthouse with 4 stars?,there is one cheap and one expensve. which one would you prefer?
Thank you! It does not matter to me.,aylesbray lodge guest house is moderate and in the south. would you like to book a room now?
"Yes, please! 7 of us will be arriving on Wednesday, and we'd like to stay 5 nights.",Booking was successful. Reference number is : PHDX0SZC . anything else?
I also want to eat at an expensive Cuban place.,I'm sorry - we don't have any expensive cuban restaurants in the area. Is there something else I can look up for you?
Is there any cuban restaurants near the hotel in the moderate range?,No I apologize. Would you be interested in a different cuisine?
"I am looking for information on a restaurant, the name of the place is ask. Can you tell me about it?",Yes sure. their address is 12 Bridge Street City Centre and their telephone number and postcode are 01223364917 and cb21uf respectively. Is there anything else you need to know?
What side of town are they in?,Ask is located in the city centre.
"Great, thanks. Can I also get some information on Hobsons House hotel?",Sure thing it is a moderately priced guesthouse.
Could you provide me with their phone number and star rating please?,The phone number is 01223304906 and the stars is 3
Book me a taxi to come by 19:30 to take me to ADC Theatre.,"I would be happy to help with your request, where will you be departing from?"
I'm leaving from pizza express fen ditton,"You're all set. A red audi will pick you up and the contact number, should you need it, is 07397899345. Can I help with anything else?"
I'm looking to book a taxi to Pembroke College for this evening.,Where will you be departing from?
I need to leave from primavera,"Great, do you have a leave by, or an arrival time in mind?"
i want to book a taxi. The taxi should go to lynne strover gallery and should depart from parkside police station.,What time would you like to leave and arrive by?
The taxi should leave after 22:15. Can I get the contact number and car type for that reservation?,You are all set! Please be on the lookout for a black lexus and the contact number is 07664673319.
I am looking for the adc theatre.,"The ADC Theatre is located in the center of town, on Park Street. Would you like their phone number?"
"Sure, and may I have their exact address please?","Park Street, post code cb58as. Anything else?"
I am also looking to stay in a 4 star hotel that includes free parking.,In what area would you like it?
I don't care about the area but I would like to make sure it is a hotel.,"The University Arms Hotel in the centre is very nice, or a more budget-friendly option is The Cambridge Belfry in the west. Would you like to book a room at one?"
What can you tell me about Magdalene College?,Magdalene College is located in the west area of town. There is no entrance fee.
Thank you for your help.,You're welcome. Let us know if you need anything else.
"I do, actually. I'd also like to find a good place to dine in the east. Do you know of any Swiss restaurants in that area?",Unfortunately there doesn't seem to be any Swiss options in the east. Could I help you with anything else?
"Hmm, I was really looking forward to Swiss food. Ok, how about an indian restaurant in the east instead?",That we can do. We have two moderately priced and two expensive Indian restaurants in the east.
what are the two expensive indian restaurants?,Sitar Tandoori and Pipasha Restaurant are the expensive options.
i want to book a hotel of moderate price in the south.,"There are no hotels in the range, but two guesthouses in the south moderately priced. Would they be something you would consider or do you want another search?"
"I need one in the south, moderate price, free wifi.",There are two guesthouses in the moderate price range in the south side of town with free Wifi. One 3 and one 4 star. Can i book one for you?
Oh. One more thing. Is there free parking?,Both options have free parking available.
"Okay, could you book one for me?",I would love to but our system is down right now.
Can you please give it one more try.,"I'd be happy to help with your request, first I'll need to know the day you'll be checking in, the number in your party, and for how many nights?"
i want to do things around town.,"Sure, what did you have in mind?"
I would like to find a college to visit.,Are you planning on visiting a particular part of town?
"No, know of an interesting one?",We're a very academic city and have 18 colleges in our community. There is St. John's College in the city center. Would you like more information about it?
"Yes, please. Can I get their phone number and the entrance fee?",Let me go ahead and look that up for you.
"Okay, thanks.",Their phone number is 01223338600 and the entrance fee is 2.50
Thanks so much. Can you also help me find a place to stay at?,absolutely. would you like a hotel or guesthouse? and in what area would you like?
I want a hotel with free wifi. I don't care about free parking or a specific area.,Will you need parking?
I'm looking for a place to go in the east.,Is there a certain type of attraction you'd like to see?
I actually haven't been to Cambridge before. Can you tell me a few types that might be in that area?,"sure thing! We have museums, entertainment and a boat. Anything there catch your fancy?"
"You pick something in the east for me. I'll need the address, postcode and entrance fee. I'm also wanting information on Anatolia. Thank you!","Lets start with the attraction information first. Cherry Hinton Water Play is a free park located at cherry hinton hall, cherry hinton road and the postcode is cb18dw."
"Great, thank you.","You're very welcome. Now, the Anatolia is a moderately priced turkish restaurant located in the city centre."
I need help finding a chinese restaurant in the centre of cambridge any suggestions?,There are 10 choices. Is there a particular area you would like to stay in?
I would like it in the centre.,There's fives places that fit that bill.. do you have a price range in mind?
"The closest is fine, can you give me the phone number and postcode of the restaurant? I am also looking for a college to visit in the area.","The closest is Charlie Chan on Regent Street City Centre. Their phone number is 01223361763. Postcode is cb21db. As for the college, do you have a preference on area?"
What is the entrance fee for Regent Street City Centre?,There isn't an entrance fee to enter the street or the restaurant.
I heard cityroomz is a good hotel. Can you give me some information on this hotel?,It is located in he centre of town and is priced in the moderate range.
Can you book it for me,Yes I can. What day will you be arriving and departing? And how many people will be staying?
I would like to book for six people and for three nights starting on Monday.,I have you booked for 3 nights starting Monday at CityRoomz. Your reference number is Z629WKMU . Is there anything else I could help you with today?
"Sure, I'm looking for places to go in town, something in the east. Can you help?",I have that here. What would you like to know?
"Can you give me the address, attraction type, and entrance fee please?","How about the abbey pool and astroturf pitch located at pool way, whitehill road, off newmarket road."
Can you help me find somewhere to stay in the south? I want it to be moderately priced please.,there are 2. one with 4 star another with 3. which one do you prefer?
"Either is fine but I would need to have wifi included, this is a business trip.","I have 2 that offer free wifi. One is rated 3 stars, the other is 4. Do you have a preference?"
How about the 4 stars one.,That would be the Aylesbray Lodge Guest House. Would you like to make a booking?
Not right now. I'm also looking for a restaurant in the same price range that serves Indian food. Can you help me with that?,I have many to choose from. Can you specify the area?
I would like it in the south.,It looks like there aren't any in the south. Would you like to try a different area?
I need a tax arriving by 17:00.,Sure! where are you going?
I am going to visit queens' college,What is your departure site?
I'm departing from ask.,I have a black honda for you with contact number 07810177049.
I need to book a taxi to leave after 07:45 to take me to Bangkok City.,Where will your departure site be?
Hi! I would like to book a taxi that will take me to Pizza Hut Cherry Hinton. I will be departing from Parkside Pools.,What time would you like to leave?
I want to leave after 02:00,I can book a Black Ford for you. The contact number of the company is 07708238835. Can I help with anything else?
Are there any places that serve Christmas food? I heard there might be something like that around here.,I am sorry I do not see any place that serves Christmas food. Would you like me to look for a different type of food?
How about some Chinese food?,I have a lot of choices for Chinese food. What price range were you looking for? Or area?
"No preference, just pick a nice one and provide me with the name and phone number please.",Yu Garden is excellent. Their phone number is 01223244149. Is there anything else I can help you with?
"Ok, so their number is 01223244149? Is there any Chinese attractions around the same area as the Yu Garden?",There are no Chinese attractions in town. Is there a different type of attraction that you are looking for?
I'd like a taxi that leaves from yippee noodle bar and leaves after 11:30.,I would be happy to book your taxi but I will need your destination and preferred arrival time as well.
I would like to go to Ballare please.,I was able to book that for you. The car will be a red toyota and the contact number is 07404635448.
I'm looking for a hotel called home from home.,Home from Home is located in the North area and is moderately priced. Would you like more information?
"No, I'd like a room for 8 people. We'll be checking in on thursday for 4 nights.",I was able to book you for 4 nights starting on Thursday for 8 people. The confirmation number is UOF6DHN8 . Is there anything else?
"Yes, I also need an expensive restaurant located in the centre.","Sure thing, what kind of cuisine are you looking for?"
I'm looking for French food.,I would recommend Cote. It is expensive but good. Can I reserve a table for you?
"Yes, please make 8 reservations for Friday night at 19:00.",That is booked! Your reference number is HQOSMVL8 . Can I help with anything else?
I need a taxi to pick me up at curry king.,"OK, and where are you headed and at what time?"
I want to go to the Lime House.,"Alright, and now I'll just need to know a time you either would like to arrive by or leave after please"
I need a taxi from london kings cross train station to the gonville hotel.,"Tell the customer what time the train departs from London kings cross train, and possible arrival time to gonville hotel."
Um what? I need to arrive by 23:00. Can you help or not?,I'm sorry about that. I have booked you a black audi arriving at the hotel by 23:00. The contact number is 07582132009.
Yes I am looking to stay in a 4 star guesthouse.,Okay. There are 18 guesthouses that match your request. Is there a particular area you are interested in?
I am looking for one with free parking and moderate in price,The Archway house matches all of your preferences. Would you like me to create a booking?
"Yes, that would be great. I would like my check-in to be on Saturday. I will be staying for 2 nights and there will be a total of 5 people.",The Archway House is in the north area of town. Does that work for you?
"Yes, and I would also like you to include the reference number for the booking.",i have that booked for you and here is your Reference number is : EZ2LETN6
"Hi, I need to get a taxi out of kohinoor.",And when would you like to leave or arrive by?
I need to leave after 07:45.,I'd love to help! Where are you going?
I am going to allenbell,"Your booking is complete, a black toyota will pick you up. The contact number is 07768938666."
I'm looking for a particular restaurant called the Pizza Express,"There seems to be two locations. They are both located in the centre of town. One is on Regent Street City Centre, and the other is on Jesus Lane Fen Dutton."
Ok can you suggest one and reserve a table for 6 at 18:30 on saturday and I need the reference number too please,"Ok, you are all booked at the pizza express on regent street. Reference number is 1ASQ2S6Y ."
Thank you! I'm also looking for a hotel called the Autumn House.,Autumn House is a cheap guesthouse in the east area of town with free internet and parking. Would you like me to book it?
"Hi, I'd like to book a taxi from the Golden Wok to the Golden Curry please.",Can you tell me what time you want to leave the Golden Wok and when you want to arrive at the Golden Curry?
I would like the taxi to leave after 09:00,"Thanks, I have booked you taxi, Booked car type, yellow bmw, and Contact number 07358048101. may I help you with anything else?"
"Hi, can you help me find a hotel, please?","Sure, we have many hotels in Cambridge. What area of town would you prefer?"
"I don't care where, I just need it to be 5 stars and include free parking.","I'm sorry, we don't have any hotels that meet that criteria. Might you be willing to accept a place with 4 stars and free parking?"
"Yes, I would like to book a four star hotel then.",We have three hotels matching that search. Could I book a room for you at the huntingdon marriott hotel?
I'd like to get a little more information first. What is the price range at the Huntingdon Marriott Hotel?,It is expensive. I can check on a cheap hotel if you'd prefer?
"No, I really want to stay at the Marriott.","Ok, great! How many guests will there be and how many days would you like to stay?"
"I don't need a reservation yet. I would like the phone number and postcode, though.","The huntingdon marriott hotel's number is 01480446000, it's postcode is pe296fl. How else can I assist you?"
Are there any swimming pools in town?,"There are, yes. There's the Abbey Pool and Astroturf Pitch in the east, the Jesus Garden Outdoor Pool and Kings Hedges Learner Pool north, and Parkside Pools in the centre."
Can you help me find an Italian restaurant in the city center?,Sure. What is your price range?
My price range is expensive.,I recommend booking a table at Caffe Uno. You'll love their homemade pasta!
That's great. Can you send me the phone number and postcode for Caffe Uno?,i'm sorry. i cannot find details for cafe uno.
I am actually looking for an Italian place. In the centre.,The cafe uno's phone number is 01223448620 and the postcode is cb21uj. May I help you with anything else?
can you help me get to cambridge by 8:30 on friday?,"I've located several trains that will arrive Friday by 8:30. To help narrow your search, where would you like to depart from?"
I would like to depart from norwich.,"I have 2 trains arriving by 8:30 in Cambridge on Friday, one arrives by 6:35, the other by 7:35. Would you like to book a seat for one of these?"
"What is the departure time for the train that arrives at 7:35, and how much do the tickets cost for that one?",That train leaves at 6:16 and costs 17.60 pounds. Would you like me to book it?
Yes that would be great I am also looking for places to go in town,"Your reference is S666W6BF, what are you looking to go do in town?"
I'd like to reserve a taxi to take me to jesus green outdoor pool today,"Sure thing, when you like to leave by?"
Just after 06:15. Please send me the taxi's contact number and car type.,Where will we pick you up?
I need a taxi to come to the place by 07:30.,"Okay - just to confirm, your departure site is the place? And where would you like the taxi to take you?"
"I need to get to Thanh Binh, please. And yes, my departure location is The Place.",Thank you. Please look for a yellow audi with the contact number 07260634336.
"Hi, I am looking for information on a restaurant it's called saffron brasserie.",Saffron Brasserie is an expensive Indian restaurant in the centre. Would you like me to make reservations?
Oh yes! Please I need a reservation for 5 people on Saturday at 18:00. I need a reference number too.,"Sure, the reference number is PSIDGHAC ."
I am also looking for places to go while in town. Do you have a swimming pool?,There are 4 places to swim in town. Does the area matter?
I'm not particular on the area; is there one near Saffron Brasserie?,Parkside Pools is in the centre. That would be closest to Saffron Brasserie.
I need a place to stay in the north area.,What is your price range? What type of hotel are you looking for? Will you need internet?
The hotel should be in a moderate price range.,We have nine guesthouses and two hotels in the north with moderate price ranges.
I would like one with 2 stars and free parking.,"There are 2 hotels, the Ashley Hotel and Lovell Lodge that fit what you are searching for. Would you like more information or to book one of these?"
Please book one of those for 6 people and 4 nights starting from Friday.,I've booked you a room at Ashley Hotel for 6 people for 4 nights beginning Friday. Your reference number is 5YAY9T1K . Can I help you with anything else?
I would also like information on jesus college,Yes sure Jesus College is located on Jesus Lane in the city's center and is free to enter. Their telephone number is 01223339485.
"Hello, I'm looking for an attraction that is in the type of multiple sports and is located in the centre.",I'm sorry. There is no multiple sports attraction in the center of town.
"No problem, are there any college places?","christ's college is in the centre, as are many other college's in fact."
"Please pick one, and tell me the entrance fee and post code.",Emmanuel college is free to visit and the postal code is cb23ap.
"I also need a moderate place to stay, with free parking.",There are 4 places to stay in the Centre area two are guesthouses and two are hotels. Do you have a type preference or price range?
"I am looking for a moderately priced hotel, that has a 4 star rating.",I'm afraid we don't have any like that in the center. There's a cheap 4-star guesthouse and an expensive 4-star hotel. Would either of those work for you?
Does it have free wifi at least?,They both have free wifi and parking. Would you like me to book one for you?
I would like a taxi by 16:30 to arrive at Nusha.,Where will you be leaving from?
"Hi, I am traveling to Cambridge soon. I am so excited to see some local tourist attractions. I could use some help with restaurants though.",Okay I can help with that. What type of food would you like to eat and what is your price range?
I am looking for an expensive Indian restaurant.,Thanks for the information. What area should the restaurant be in?
It should be in the west.,The India House is located on the West side and offers a wide range of fine diners.
