question,answer
"It doesn't really matter what area. But, I really prefer a hotel over a guesthouse. Do you have any?","I have two options, the Huntingdon Marriott Hotel or the University Arms Hotel. Do you prefer one over the other?"
We were wanting to have free wifi. Do either of them provide that?,"Both of these two offer free wifi, The Marriott is in the Hinchinbrook Business Park, while the University Arms is on Regent Street downtown."
I would like to book the University Arms for five nights. Could you do that for me?,I can! When would you like the booking to start? And how many in your party?
2 people and 5 nights starting on teusday,Booking was successful. Reference number is : F063DE8D
I am looking for places to go and I would like something in the centre.,I have many options available in the centre. Is there a particular attraction type you are looking for?
"I am looking for any type of attraction in the centre, just need the entrance fee, phone number, and attraction type.",I recommend all saints church. It is some nice architecture. There is no entrance fee and the phone number is 01223452587.
Great. I'm going to need a hotel too. It needs to be cheap but have a 4 star rating.,"Sorry, there are hotels with that criteria. Would you like me to modify the area or some other part and look again?"
I would like it to be in the same area as all saints church.,"There are no cheap, 4 star hotels located in the same area as the All Saints Church. There is a guesthouse though that is cheap and has 4 stars."
Can you check again?,Sure. No. There is only a guesthouse called Alexander Bed and Breakfast.
i want to go to a park,"Sure, there are a few. What part of town do you prefer?"
anywhere is fine. May I get a postcode ?,"There are 5 different parks. Postcodes are CB21JF, CB18DW, CB46AZ, CB22AD, and CB223AE."
"I'm also looking for a hotel to stay in. I need to make sure it's a hotel and not a guesthouse, with a star of 4.",I have three 4 star hotels. what are or price range do you prefer?
The price doesn't matter. I do want it to be in the north area of town though.,"I'm sorry, I don't have any 4 star hotels in the north. Would another area be ok, or should I check other star rating options?"
Are there any 4 star guesthouses in the north available?,"No, I'm afraid there aren't."
Could you look for something that isn't a guesthouse then?,There are no hotels that meet your requirements.
Hello! I would like to book a taxi from hughes hall.,Great. Where would you like to go and what time do you want to leave or arrive by?
I'm going to Ali Baba from Hughes Hall. I would like the taxi to arrive at Hughes Hall at 2:45.,"It sounds like you wish to depart Hughes Hall and arrive at Ali Baba by 2:45, is this correct? If so, I've booked a black Ford for you, contact 07392863087."
I need a place to eat that is cheap.,I have several inexpensive restaurants in different areas of town. Do you have a location preference?
Yes. I want the center area.,i can recommend rice house that serves chinese food
Do you have any restaurants that serve english food?,I am showing nothing for english food in the centre area. Would you like to try something else?
How about some awesome Indian food. I need a table for 8 on 16:30 monday,i booked you at kohinoor. The table will be reserved for 15 minutes. Reference number is : 1OB1SN34 . is there anything else i can help you with?
I want to check out a theater in the south area of cambridge.,"There is one theater located in southern Cambridge. The Junction is located on Clifton Way, cb17gx. You may can 21223511511 for more information.,"
What is the entrance fee?,"Unfortunately I don't have that information. But, again, you could call them at 01223511511 for that information."
What is the postcode?,"Postal code is cb17gx, the address is clifton way."
"Can you recommend a moderately priced hotel in the centre, that has free internet and free parking?",There are not any in the area that match your requirements. Would you like me to check another area?
How about one in the south?,"Yeah, there are two in the south. Aylesbray Lodge and Bridge Guest House. Do you have a preference between the two?"
"Hi there, I'd like to find a good restaurant for tonight. I'd like somewhere in the city centre, and I'm willing to pay a moderate amount of money.",There are a lot of great restaurants that are moderately priced in that area. Which type of food would you like?
"Somewhere that serves light bites, please",There is no place in that area that serves light bites. Would you like to try a different area or cuisine perhaps?
"What about a restaurant that serves European food, but still in the centre and moderately priced?","There are 4 restaurants that match your request, would you like to book one of them?"
"No, but could you give me the address and phone number for your favorite one?","The hotel du vin and bistro is a great place, they are located at 15-19 trumpington street and reachable at 01223227330"
Are there any places to stay in the same general area as the restaurant?,I have 33 hotels in that area. Do you have a price range that you would like to stay in?
"I need to stay in the moderate price range, please.",I have the Cityroomz that is moderately priced. Would you like a booking?
"Actually, could I just get its phone number and address?","Sure, Cityroomz is located at sleeperz hotel, station road and the number for them is 01223304050. Is there anything else I can help you with?"
Can we book a guesthouse in the centre?,"Of course, how many nights will you be staying, and how many people will there be?"
can you help me find a cheap hotel?,There are 10 cheap hotels is there an area you prefer?
"On second thought, I don't care what price it is. I just really need a guesthouse with free parking.",I have many cheap guesthouses across the city. What area are do you prefer and if no preference would you like me to recommend something?
i prefer the west side. it should also have free wifi,"There is nothing on the West side,want to try a different area ?"
"I don't need it to be cheap, but I really need it to be in the west and have free parking and wifi.",Finches Bed and Breakfast has free parking and wifi. Would you like me to book it for you?
Yes please and i'll need the reference number,What day do you need it for and for how many days and how many people?
Starting Sunday for 7 people for 4 nights.,I am unable to book the room at this time.
I am looking for places to visit in downtown Cambridge. What are some popular attractions?,"There is architecture, boats, colleges, museums, and many other things."
Recommend something that's in the center of town for me.,The Cambridge Contemporary Art museum is a fantastic place to visit. It's located at 6 Trinity Street and admission is free! Do you need more information?
I'm also looking for a place to stay.,What area would you like to stay in?
I want to stay in the center of town in a 0 star hotel that is moderately priced and has free parking.,"There's not an exact match to fit your needs. There's a hotel without free parking available. Or, if you need the free parking, would a cheap guesthouse work instead?"
Can you help me find a restaurant in the middle price range?,"Sure thing, I would suggest the copper kettle."
Is it located in the South? Does it serve Lebanese food?,I have no matches. Do you have any other preferences?
How about italian food?,Pizza hut is in that are and will suit your needs. The address is G4 Cambridge Leisure Park Clifton Way Cherry Hinton. Can I help you with anything else?
"Yes, please. I need a reservation for 3 people at that restaurant starting at 18:30 on tuesday",I've reserved a table at 18:30 on Tuesday for 3. Your reference number is GCGHXNVN . Can i help you with anything else?
I would also like to know more about fun places to go in the south.,There are 8 different attractions in the south. Do you have a type in mind?
Please help me reserve a taxi from saint catharine's college,Sure! when would you like to arrive?
I would like to arrive by 01:15.,Great! And what is your destination?
I am looking for places to go here in the centre of town. Could you please assist me?,"What kind of place? Are you looking for entertainment, dinner, culture, or what?"
I would like to go to a museum please.,I recommend Castle Galleries.
Does Castle Galleries have an entrance fee?,"No, Castle Galleries is free to enter!"
Wonderful. I am also looking for a Chinese restaurant near the Castle Galleries. Can you book me a table for 7 people on Sunday at 12:30?,"Would you like a cheap, moderate, or expensive restaurant?"
Hi there! I'm looking for something fun to do in the center of town. What kind of attractions are there?,Yes I have many architectural attractions would you be interested in those?
Yes! I'd like a phone number and address of one of those.,"Sure, all saints church phone is 01223452587. And address is Jesus Lane. Anything else?"
Yes I am looking for a restaurant called cafe uno.,"I found a restaurant named Caffe Uno at 32 Bridge Street City Centre, their number is 01223448620. Would you like me to make you a reservation?"
Yes please. I'll need a table for 4 at 19:15 on Wednesday.,Booking was successful. The table will be reserved for 15 minutes. Your reference number is BCM0D5Y2 . Is there anything else I can help you with?
I want a place to dine in the centre of Cambridge with moderate pricing,I have plenty of options for you. Is there any certain type of food you are looking to eat today?
I would like an Italian restaurant in the centre and need a reservation for 6 people at 14:00 on Monday and please provide the reference number.,I have reserved a table at pizza express. Your reference number is STRPXCFT . Do you need anything else?
Yes. Are there any colleges nearby that I can visit?,There are about 13 colleges in the centre of town. Might I suggest Hughes Hall. They offer free entrance and are located on Wollaston Road.
Thank you! What is the address/postcode for Hughes Hall?,The address is wollaston road and the postcode is cb12ew. Is there anything else I can help you with?
I would like to book a taxi from stevenage train station and go to cineworld cinema.,I have you booked in a grey ford with a contact number of 079724240082. Can I do anything else for you?
That's all I need thank you!,"great, have an amazing day"
I'm looking for a guesthouse style place to stay. It needs to have free parking.,There are many guesthouses that meet this criteria. Is there a specific area you would like to stay in?
I would like to stay in the West,I have 2 guesthouses matching your criteria. The Finches Bed and Breakfast guesthouse is 4 stars and includes free parking and internet. Would you be interested in this?
I am looking for a guesthouse with 0 stars.,"I'm sorry, I can't find a guesthouse that meets those specifications. Is there anything else I can help you with?"
Is there one in the north?,"Yes, the city centre north b and b is a zero star guest house in the north, with free parking and free wifi. Would you like it booked?"
Not yet. Can I get the phone number for the hotel first?,"Yes, the number is 01223312843"
We are visiting for a couple days and would like to see some boat attractions in town. What do you have available?,Depends on what area of town you'll be visiting.
"I haven't decided on what area of town I will be staying in, I would just like to know the boat attractions please.","There are only boat attractions in the east, north and centre so If i was you I wouldn't stay in the west or south."
Ok. I would like the name of a specific boat attraction please.,The camboats in the east side is highly suggested. Would you like any information on them?
What is the entrance fee?,"I'm sorry, but I have checked all the boat attractions in the other areas of town and none have entrance fees listed. Can I help with something else?"
Need a moderately priced hotel with 4 stars.,"I'm sorry, there are no moderately priced 4 star hotels in town. Would you like to try a different rating or price?"
Could you find me something that includes free parking and wifi?,The Ashley Hotel is located in the north and has a 2 star rating in the moderate price range Would you like me to make a reservation for you
Great can I book a room for 7 people for 2 nights starting thursday?,I booked you rooms for 7 people staying 2 nights at Ashley Hotel. Your reference number is ZWCF98NW . Can I help you with anything else today?
i am also looking for a restaurant in centre of town serving british food,There are several is there a certain price range you are looking for?
I'd like to find the Lensfield Hotel.,"The Lensfield Hotel is location on 53-57 Lensfield Road, postcode cb21en. Would you like to look at booking a room?"
Yes please I will be there three nights. Send me a reference number please.,"Sure, I can do that. Can you let me know what days you would like to stay?"
I'll be there on Tuesday.,You're all set; your reference number is: 0IKY6DF0 . I hope you enjoy your stay.
Thank you. I am also looking for places to go in town.,Should it be in the same area of town as the hotel?
I'm looking for a theatre in the centre of town.,adc theatre fits those criteria. Would you like more information on it?
"Yes, I'm looking for a place to stay. My family can't wait to visit some of the local attractions there.",I can help with that. Do you have a preference ?
"They really dislike the small size of most guesthouses, so why don't we look for hotels instead.","Where does your budget lie, between expensive and cheap?"
Moderate pricing and book it for 2 people for 5 nights starting on Weds and i need ref number,I have a place called the Lovell Lodge. I was able to book you successfully. Reference number is : MKVVDABX . Is there anything else I can help you with?
"yes, i'm looking for information on an attraction called byard art","Byard Art is a fantastic free museum on the south side of town. It's located at 14 King's Parade, cb21sj."
What's the fee for that?,It is actually free. What else can I tell you?
"Hello, I'm looking for a college to go to.",I can certainly help with that. We have 18 colleges around the city. Is there a certain area you prefer to visit?
"What's the most popular? May I have the postcode, entrance fee, and what area is it in?",Christ's college is popular. It is in the centre and does not have an entrance fee.
"Yes, thank you that will be fine.",Christ's college is located at saint andrew's street in the centre and their postcode is cb23bu.
Wonderful. I am also looking for a moderately priced place to stay with a 4 star rating. I would like for it to have free wifi and in the west.,There are no establishments matching your criteria. Would you like to try another part of the city?
Can you then search for one that is in the South?,Yes. I would recommend Aylesbray Lodge Guest House in the south.
i need to find a place to stay in the east side,I have 7 such places to stay. Is there a specific price point you would like to stay in or do you need parking and/or wifi?
I need a room in the expensive price range.,I think you would enjoy Express by Holiday Inn Cambridge.
I'd also like it to have a 4 star rating.,"Unfortunately, I do not happen to have anything 4-star rated that is expensive and in the east. Would you like me to try a different price range or area?"
"Yes, can you try a moderately priced place instead?",I would recommend A and B Guest House. It fits your criteria except it is in a moderate price range.
"That sounds great! May I have their address, please?","A and B guest house is on 124 tenison road, cb12dp. Can I help you with anything else?"
Hi I'm looking to look at boats. Can you look at centre of town?,The Cambridge Punter is a boat located in the centre at 251a Chesterton Road.
I think that sounds interesting. Can you tell me their postcode?,The postal code for The Cambridge Punter is cb41as. Is that all you needed help with today?
Actually I could use some help finding an italian restaurant in the centre of town.,"We have 9 Italian restaurants in the Centre, do you have a particular price range you are looking for?"
It is a special occasion so it can be expensive!,stazione restaurant and coffee bar is a very popular expensive Italian restaurant in the Centre. It is located on Market Hill City Centre.
I would like help booking a taxi please. I will need the Taxi to pick me up at the Peterborough Train Station at 18:45,"Okay, could you please tell me where you would like to travel to?"
i would like travel to the good luck Chinese food takeaway. I also need the contact number for the taxi.,Taxi has been booked and it is a black bmw and the contact number is 07820748832. Can I help you with anything else?
Please find an expensive restaurant in the centre.,"There are many to choose from. What kind of food are you interested in? Asian, gastropub, indian, eupopean? Any idea?"
A gastropub sounds great.,I suggest the slug and lettuce on Green Street. Would you like me to make a booking?
"Yes, please, I need a table for 8 on Tuesday at 17:45.","I got your table all booked, your reference # is: O33823V4 . Can I help with anything else today?"
I'd like to find a place to go in town,Anything in particular you like to do?
How about a multiple sports place near that restaurant.,"the cherry hinton village center is in the east, would you like the address?"
"Yes, I am looking for information for a restaurant of moderate price serving catalan food.","I'm sorry, I don't have any restaurants that fit your needs, would another food type work for you?"
How about a restaurant that serves British food?,There are 5 British restaurants that are moderately priced. Would you like to book a table with one of them?
Can you recommend a good one for me? I'll need the address and postcode.,"The Oak Bistro is my favorite. They are located at 6 Lensfield Road, cb21eg. Can I help with anything else today?"
"Yes. I would like to go to a museum in the Centre of town. If price is no object, what's the best one?","There are quite a few museums in the centre of town, would you be interested in the Primavera or Cambridge Contemporary Art? If not there are others i can suggest."
I need a train to get to stansted airport by 17:30,do you have a day that you want to travel on ?
"Yeah, Tuesday. Thanks.",I will also need your departure city.
cambridge. get me the travel time,There are trains on the :08 every hour on Tuesday. The one closest to your arrival time leaves cambridge at 16:40. It's a 28 minute journey.
I also need the name and number of an expensive place to dine in the city center. Whatever you recommend.,What type of food would you like?
Good morning. I am planning a visit to Cambridge and need some help with details. I hear there are a lot of places to see.,There are plenty of attractions. What area of town are you interested in?
I am interested in the east part of town.,"There are 10 different attractions on the east side. There's a boat, a couple of entertainment venues, a few museums, a multiple sports complex, a park, and a swimming pool."
"Great! What I really need is a guesthouse in the East, What do you have available?",There are 6 guesthouses in the east area. What price range are you looking for?
Price does not matter but it needs to have free parking.,"5 places offer, I recommend warkworth house, would you like me to book you?"
I would like to book for 5 people for 4 nights starting on Monday,The booking was unsuccessful. Do you have a preference for another day?
I am looking for information for Warkworth House.,"Certainly. The Warkworth House is a 4 star, moderately priced guesthouse located in the east area. The address is Warkworth Terrace, postcode cb11ee. The phone number is 01223363682."
Thank you. Does this guesthouse provide internet?,"Yes, would you like me to book a stay for you today?"
"Right now I am just gathering information. What is it's price range, star of the hotel, and also is internet available?","It is moderately priced, 4 stars, and internet is available."
I'd also love to go to a swimming pool. Can you find me one?,"In the same area, you'll find the Abbey Pool and Astroturf Patch."
I want to know about 4 star hotels that include free parking for guests.,What area of town would you like to stay in?
It doesn't matter but it should be a guesthouse.,There are about 16 choices. Maybe we can narrow it down if you tell me what price range you were looking at?
"guesthouses not hotel, sorry can you suggest one and give me their phone number please",I have 33 guesthouses all over town ranging from cheap to moderate. What area do you prefer and which price range will work for you.
As long as it's a guesthouse with 4 stars and free parking I will be happy. Which one do you recommend?,"There are 16 all over town, that meet your criteria. If you could tell me which part of town you would prefer, that would help narrow the choices down."
"Please give me the phone number of a guesthouse, it doesn't matter where it is, as long as it has parking and 4 stars.",The acorn guest house has parking and 4 stars. Their telephone number is 01223353888. May I help you with something else?
Taxi to de luca cucina and bar please,What time would you like to arrive at your destination?
"Hello, I am looking for a guesthouse to stay in and I would like it to have free parking.",Does location or price range matter?
No but it would also need free wifi.,"We have 21 guesthouses all over Cambridge, I can narrow that down further if you tell me what part of town you're interested in"
I need the North part of town,How about the acorn guesthouse?
has it free parking?,"Yes, the parking is free."
Can you book it for me and get a reference number ?,Sure can! What day are you checking in?
i would like to check in on monday at 5:30,How many nights would you like to stay?
"monday and I actually meant 17:30 and for 6 people. Sorry, things are hectic and im a little scatterbrained.",But how many nights are you staying?
Just one please.,Booking was successful. Reference number is : 2JXK0SQ0 . Anything else I can help with?
I'm looking for a place to go in the centre.,Okay! What kind of place would you like to go?
I'm wanting to see the new Reese Witherspoon movie. Would they happen to have a cinema in that area?,"Yes, this is the only cinema in the area vue cinema."
Could you tell me the postcode of that cinema?,Vue cinema is located in the centre of town. Their post code is cb11ps
"Great! I also want a restaurant in the same area, something expensive, please?",There are more than two dozen expensive restaurants in that area. What cuisine would you like?
"I'm not picky. Whichever one you choose will be fine. I just need a phone number, address, and postcode please.","Alright It's called Bedouin it's an African cuisine. The information is the following; phone 01223367660, address 100 Mill Road City Centre, and the postcode is cb12bd."
Can you reserve me a taxi? I need it to take me from the restaurant to the movies.,What movie theater would you like to go to?
"Hello, can you recommend local restaurants?",I have many options for restaurants in the area. Is there a certain type of food you would like me to find information on?
No. I am interested in the Cambridge Arts Theatre. Can you provide me with the phone number and postcode?,"Their phone number is 01223503333, and their postcode is CB23PJ. Can I help you with anything else?"
"Thanks for the theatre info. Let's go back to the restaurant search. I feel like Spanish food, in the moderate price range, please.",La Tasca sounds perfect for you. Would you like me to book it?
"Yes, please book for 5 people on tuesday at 14:30. And I will absolutely need a reference number from you",You are booked with reference number NK0DZ1YI . Anything else?
"Hello, I need some assistance with finding a nice Italian restaurant in centre of Cambridge.",How much money did you want to spend?
I am interested in cheap restaurants.,"Great! How about Ask restaurant, at 12 Bridge Street City Centre? May I book you a table?"
"Yes please, just me on Tuesday, at 15:30.",Your booking was successful. Your reference number is ASSBU60Y . Can I help you with anything else today?
"Yes, I'm also looking for a place to stay for the night, and I can't break the bank on it either.",We have many inexpensive hotels. Did you have any area in mind?
Can you find me an expensive restaurant in the north side?,There are 5 available. Do you want to specify a food type?
"Yes, are there any that serve persian food? I would also like a phone number.",None of them serve persian food. Would you like to search for another option?
"It doesn't really matter then. I just need to know the type of food, name of the restaurant, and their phone number.",May I suggest Hakka? It is a Chinese food. The phone number is 01223568988. Is there anything else i can help you with?
"I am also looking for a place to stay, preferably a 2 star hotel.","May I suggest the Ashley Hotel, the Express by Holiday Inn Cambridge or the Lovell Lodge as recommend hotels to stay in. These are all two stars hotels."
Can you please send me reviews,there are no reviews available at this time for the three hotels mentioned.
I'm looking for a moderate price hotel in the north part of town.,I found 11 moderately priced hotels on the north side. Is there a star rating you would prefer? What about parking or internet?
"I don't care about star rating so much, but it the hotel needs to include free wifi.",There are 10 hotels which match your requirements. Do you need parking?
Yes I need parking.,How about the acorn guest house? It has parking and wifi.
"That will work. What is the phone number, address, and star rating for the hotel?","Sure, the phone number is 01223353888, the address is 154 Chesterton Road, and it has a 4 star rating."
